{
 "id": "mhs-to-khun-yuam",
 "type": "leg",
 "names": {
  "name": "Mae Hong Son to Khun Yuam",
  "th": "แม่ฮ่องสอน – ขุนยวม",
  "said": "Over the mountains and onto the long road south.",
  "said_th": "ข้ามเขาแล้วออกสู่ถนนสายยาวลงใต้"
 },
 "region": [
  "loop"
 ],
 "facets": {
  "days": "1",
  "direction": "both"
 },
 "text": {
  "what": "Route 108 south. The climb out of the Mae Hong Son valley, then the first of the long southern running.",
  "story": "The Thai Wikipedia article describes this section from the other end: the road crosses the mountains to drop into Mae Hong Son town, having climbed from Ban Mae La Luang past Khun Yuam. Ridden southbound you do that in reverse — climb out, then run.\n\n*Inference —* the road changes character. After three days of 1095 this feels open and fast, and the curves that remain are longer-radius. Riders who have adjusted to nearly six curves a kilometre take a leg or so to recalibrate."
 },
 "text_th": {
  "what": "ทางหลวง 108 ลงใต้ ไต่ขึ้นจากหุบแม่ฮ่องสอน แล้วเริ่มช่วงยาวของทางใต้",
  "story": "บทความวิกิพีเดียภาษาไทยบรรยายช่วงนี้จากอีกด้าน ถนนข้ามภูเขาเพื่อลงไปยังตัวเมืองแม่ฮ่องสอน หลังจากไต่ขึ้นจากบ้านแม่ลาหลวงผ่านขุนยวม ถ้าขี่ลงใต้ก็ทำแบบกลับกัน ไต่ขึ้นก่อน แล้วค่อยวิ่ง\n\n*อนุมาน —* ถนนเปลี่ยนลักษณะ หลังจากสามวันบน 1095 ช่วงนี้จะรู้สึกโล่งและเร็ว และโค้งที่เหลือมีรัศมีกว้างกว่า คนขี่ที่ปรับตัวเข้ากับเกือบหกโค้งต่อกิโลเมตรแล้วต้องใช้เวลาราวหนึ่งช่วงในการปรับกลับ"
 },
 "route": {
  "roads": [
   "108"
  ],
  "from": "Mae Hong Son",
  "from_th": "แม่ฮ่องสอน",
  "to": "Khun Yuam",
  "to_th": "ขุนยวม",
  "km": 67,
  "hours": "1.5",
  "hours_big": "1.25",
  "cw": "The start of the way home, and the first easy riding in three days.",
  "ccw": "The last climb before Mae Hong Son.",
  "cw_th": "จุดเริ่มของทางกลับบ้าน และเป็นการขี่สบายครั้งแรกในรอบสามวัน",
  "ccw_th": "ทางไต่ขึ้นครั้งสุดท้ายก่อนถึงแม่ฮ่องสอน",
  "order": 4
 },
 "riding": {
  "min_class": "auto",
  "grip": "easy",
  "pillion": "fine",
  "note": "Open, sealed, two lanes.",
  "note_th": "โล่ง ลาดยาง สองเลน"
 },
 "kin": [
  {
   "to": "khun-yuam",
   "as": "The town at the end, and the junction for the cut.",
   "rel": "town"
  },
  {
   "to": "route-108",
   "as": "The road it is on.",
   "rel": "road"
  },
  {
   "to": "the-1263-cut",
   "as": "The decision waiting at the end of it.",
   "rel": "leg"
  }
 ],
 "sources": [
  "s:thwp-108",
  "s:wp-khun-yuam-district"
 ],
 "provenance": {
  "default": {
   "tier": "inference",
   "note": "leg description is this project's, built on the measured geometry and the cited road articles"
  },
  "fields": {
   "text_th": {
    "tier": "inference",
    "note": "written in Thai by this project, not machine-translated"
   }
  }
 },
 "confidence": "medium",
 "schema": 1,
 "updated": "2026-09-18"
}
